{
  "contract": {
    "name": "gsa.deployment-instance",
    "version": "0.1.0"
  },
  "id": "minecraft-survival",
  "profile_id": "minecraft-java",
  "host": "wizardly-hellman",
  "runtime": {
    "type": "systemd",
    "identity": "minecraft.service"
  },
  "ports": [
    {
      "protocol": "tcp",
      "port": 25565,
      "purpose": "game"
    }
  ],
  "paths": {
    "data": ["/opt/minecraft-server"],
    "config": ["/opt/minecraft-server/server.properties"],
    "world": ["/opt/minecraft-server/world"]
  },
  "game": {
    "version": "1.21.11",
    "update_channel": null,
    "mods": [
      { "id": "fabric-loader", "version": "0.18.1" },
      { "id": "fabric-api", "version": "0.141.3+1.21.11" },
      { "id": "npc-mcp", "version": "0.1.0" },
      { "id": "spark", "version": "1.10.170" },
      { "id": "chunky", "version": "1.4.55" }
    ]
  },
  "resources": {
    "memory": {
      "minimum": "1G",
      "maximum": "2G"
    }
  },
  "backup": {
    "policy_ref": null
  },
  "capabilities": {
    "probe": {
      "enabled": true,
      "mode": "read-only"
    },
    "config": {
      "enabled": true,
      "mode": "read-only"
    },
    "logs": {
      "enabled": true,
      "mode": "read-only"
    },
    "lifecycle": {
      "start": false,
      "stop": false,
      "restart": false,
      "update": false
    },
    "backup": {
      "enabled": false
    }
  }
}
