{
  "contract": {
    "name": "gsa.deployment-instance",
    "version": "0.1.0"
  },
  "id": "minecraft-creative",
  "profile_id": "minecraft-java",
  "host": "fixture-host",
  "runtime": {
    "type": "systemd",
    "identity": "gsa-fixture-minecraft-creative.service"
  },
  "ports": [
    {
      "protocol": "tcp",
      "port": 25566,
      "purpose": "game"
    }
  ],
  "paths": {
    "data": [
      "/srv/gsa-fixtures/minecraft-creative"
    ],
    "config": [
      "/srv/gsa-fixtures/minecraft-creative/server.properties"
    ],
    "world": [
      "/srv/gsa-fixtures/minecraft-creative/world"
    ]
  },
  "game": {
    "version": "1.21.11",
    "mods": []
  },
  "resources": {
    "memory": {
      "minimum": "1G",
      "maximum": "2G"
    }
  },
  "backup": {
    "policy_ref": "minecraft-world-backup"
  },
  "capabilities": {
    "probe": {
      "enabled": true,
      "mode": "read-only"
    },
    "config": {
      "enabled": true,
      "mode": "read-only"
    },
    "logs": {
      "enabled": true,
      "mode": "read-only"
    },
    "lifecycle": {
      "start": false,
      "stop": false,
      "restart": false,
      "update": false
    },
    "backup": {
      "enabled": false
    }
  }
}
