{
  "contract": {
    "name": "gsa.deployment-instance",
    "version": "0.1.0"
  },
  "id": "barotrauma-coop",
  "profile_id": "barotrauma",
  "host": "fixture-host",
  "runtime": {
    "type": "podman",
    "identity": "gsa-fixture-barotrauma-coop"
  },
  "ports": [
    {
      "protocol": "udp",
      "port": 27015,
      "purpose": "game"
    }
  ],
  "paths": {
    "data": [
      "/srv/gsa-fixtures/barotrauma-coop"
    ],
    "config": [
      "/srv/gsa-fixtures/barotrauma-coop/serversettings.xml"
    ],
    "world": [
      "/srv/gsa-fixtures/barotrauma-coop/saves"
    ]
  },
  "game": {
    "version": "fixture-pinned",
    "update_channel": "pinned",
    "mods": []
  },
  "resources": {
    "memory": {
      "minimum": "1G",
      "maximum": "2G"
    }
  },
  "backup": {
    "policy_ref": "barotrauma-campaign-backup"
  },
  "capabilities": {
    "probe": {
      "enabled": true,
      "mode": "read-only"
    },
    "config": {
      "enabled": true,
      "mode": "read-only"
    },
    "logs": {
      "enabled": true,
      "mode": "read-only"
    },
    "lifecycle": {
      "start": false,
      "stop": false,
      "restart": false,
      "update": false
    },
    "backup": {
      "enabled": false
    }
  }
}
